{
  "schema_version": "ged-core-processing-plan/0.1",
  "ged_core_machine_version": "0.1.0-candidate",
  "ruleset_version": "0.1.0",
  "capability_registry_version": "0.1.0-candidate",
  "decision": "PROFILE_CANDIDATE_PRODUCED",
  "selected_capabilities": [
    {
      "capability_id": "NATIVE_MIME_EMAIL_EXTRACTION_V0.1",
      "version": "0.1.0",
      "order": 1,
      "reason": "Native structured container satisfies requested extraction without OCR or visual recognition"
    },
    {
      "capability_id": "JSON_SCHEMA_VALIDATION",
      "version": "0.1.0",
      "order": 2,
      "reason": "Validate normalized deterministic output"
    }
  ],
  "excluded_capabilities": [
    {
      "capability_id": "PROFILE_DRIVEN_OCR_GEOMETRIC_EXTRACTION_V0.1",
      "reason": "Native text and MIME structure already satisfy the need"
    },
    {
      "capability_id": "ULISTAG-VISUAL-KEYPOINTS-ORB-HAMMING-RANSAC",
      "reason": "Visual recognition is unnecessary for container-native identity"
    },
    {
      "capability_id": "LLM",
      "reason": "Not required and not part of deterministic capability set"
    }
  ],
  "reused_profile_id": null,
  "unsatisfied_requirements": [],
  "expected_outputs": [
    "normalized_message_json",
    "parse_status",
    "attachment_inventory"
  ],
  "limits": [
    "Phase-1 synthetic corpus only",
    "No sender authenticity qualification"
  ],
  "canonical_sha256": null
}
